record_id,redcap_repeat_instrument,redcap_repeat_instance,redcap_survey_identifier,form_1_timestamp,form_1_complete,experience_log_timestamp,exp_time,current,past,type,location,loc_spec,descr,feedback,identity___1,identity___2,identity___3,identity___4,identity___5,identity_spec,social_type___1,social_type___2,social_type___3,social_type___4,removal,future_use,uuid_2,startdate_2,enddate_2,scheduledate_2,status_2,supplementaldata_2,serializedresult_2,experience_log_complete
THUAS_S006,,,,,0.0,,,,,,,,,,,,,,,,,,,,,,,,,,,,,
THUAS_S006,experience_log,1.0,,,,,2.0,,2025-03-31 21:25,2.0,1.0,,around 21h i decided to fill in all the hours for the rest of the day on the sheet since I knew what activities i would be doing and how much light i would be exposed to. looking back; I think the estimates were correct,0.0,0.0,0.0,0.0,0.0,0.0,,0.0,0.0,0.0,0.0,0.0,"i will try to log the sheet on multiple occassions. i tried doing it digitally, but pen on paper is fine as well. i will liekly keep the daily sheet in my pocket incl. the pen",A43F5870-0E76-11F0-87D3-2F1D4C74B2C3,2025-03-31 23:25:17,2025-03-31 23:28:37,,1.0,"{    ""devicemanufacturer"": ""samsung"",    ""deviceplatform"": ""Android"",    ""deviceversion"": ""13"",    ""syncdate"": ""2025-03-31 23:28:38"",    ""utcTime"": ""2025-03-31 21:25:17.303338Z"",    ""projectLanguageSelected"": ""en-US"",    ""timezone"": ""CEST"",    ""appversion"": ""2.2.0"",    ""buildnumber"": ""155"",    ""configversion"": ""1"",    ""devicemodel"": ""SM-G780G"",    ""percentComplete"": ""62""  }",result.zip,0.0
THUAS_S006,experience_log,2.0,,,,,2.0,,2025-03-31 17:00,2.0,2.0,,"on the streets, many people looked at me, or at least more than normal. at work, some people asked if I was filming them, and in general many people were curious especially about the glasses. i shared the story at least 10 times today, most thought it was interesting but would not want to participate or could not due to a prescription of glasses ",1.0,0.0,1.0,0.0,0.0,0.0,,0.0,1.0,0.0,0.0,0.0,"well I will probably have to tell the story at least 20 more times I expect, so maybe it would be handy to keep to link to the webpage ready  ",1C79B240-0E77-11F0-87D3-2F1D4C74B2C3,2025-03-31 23:28:39,2025-03-31 23:31:44,,1.0,"{    ""devicemanufacturer"": ""samsung"",    ""deviceplatform"": ""Android"",    ""deviceversion"": ""13"",    ""syncdate"": ""2025-03-31 23:31:45"",    ""utcTime"": ""2025-03-31 21:28:39.012548Z"",    ""projectLanguageSelected"": ""en-US"",    ""timezone"": ""CEST"",    ""appversion"": ""2.2.0"",    ""buildnumber"": ""155"",    ""configversion"": ""1"",    ""devicemodel"": ""SM-G780G"",    ""percentComplete"": ""77""  }",result.zip,0.0
THUAS_S006,experience_log,3.0,,,,,2.0,,2025-03-31 21:30,2.0,1.0,,girlfriend got home and commented on the glasses,1.0,1.0,0.0,0.0,0.0,0.0,,1.0,0.0,0.0,0.0,0.0,"my girlfriend thought the glasses didn't look very great, but she likes how I'm contributing to science",8BB3AA30-0E77-11F0-87D3-2F1D4C74B2C3,2025-03-31 23:31:45,2025-03-31 23:33:29,,1.0,"{    ""devicemanufacturer"": ""samsung"",    ""deviceplatform"": ""Android"",    ""deviceversion"": ""13"",    ""syncdate"": ""2025-03-31 23:33:29"",    ""utcTime"": ""2025-03-31 21:31:45.619520Z"",    ""projectLanguageSelected"": ""en-US"",    ""timezone"": ""CEST"",    ""appversion"": ""2.2.0"",    ""buildnumber"": ""155"",    ""configversion"": ""1"",    ""devicemodel"": ""SM-G780G"",    ""percentComplete"": ""77""  }",result.zip,0.0
THUAS_S006,experience_log,4.0,,,,,1.0,2025-04-01 08:07,,3.0,4.0,all the time,"the glasses do require me to keep adjusting it by pressing them up again, but maybe I just have to get used to wearing glasses",0.0,0.0,0.0,0.0,0.0,0.0,,0.0,0.0,0.0,0.0,0.0,"i just keep wearing them, nothing to do. it happens especially when looking downward",998D92E0-0EBF-11F0-9277-AB74C97EF6E6,2025-04-01 08:07:32,2025-04-01 08:10:56,,1.0,"{    ""devicemanufacturer"": ""samsung"",    ""deviceplatform"": ""Android"",    ""deviceversion"": ""13"",    ""syncdate"": ""2025-04-01 08:10:57"",    ""utcTime"": ""2025-04-01 06:07:32.622752Z"",    ""projectLanguageSelected"": ""en-US"",    ""timezone"": ""CEST"",    ""appversion"": ""2.2.0"",    ""buildnumber"": ""155"",    ""configversion"": ""1"",    ""devicemodel"": ""SM-G780G"",    ""percentComplete"": ""70""  }",result.zip,0.0
THUAS_S006,experience_log,5.0,,,,,1.0,2025-04-01 08:11,,3.0,4.0,there has been a constant smudge in the top left corner of my right spectacle.  so far i could not remove it,it kind of subtly block some of my vision,0.0,0.0,0.0,0.0,0.0,0.0,,0.0,0.0,0.0,0.0,0.0,i will keep wearing them and keep cleaning ,16FD3CD0-0EC0-11F0-9277-AB74C97EF6E6,2025-04-01 08:11:03,2025-04-01 08:12:42,,1.0,"{    ""devicemanufacturer"": ""samsung"",    ""deviceplatform"": ""Android"",    ""deviceversion"": ""13"",    ""syncdate"": ""2025-04-01 08:12:43"",    ""utcTime"": ""2025-04-01 06:11:03.069389Z"",    ""projectLanguageSelected"": ""en-US"",    ""timezone"": ""CEST"",    ""appversion"": ""2.2.0"",    ""buildnumber"": ""155"",    ""configversion"": ""1"",    ""devicemodel"": ""SM-G780G"",    ""percentComplete"": ""70""  }",result.zip,0.0
THUAS_S006,experience_log,6.0,,,,,1.0,2025-04-04 19:44,,1.0,4.0,i am in a concert,i wonder how the concert is visible in the sensor,0.0,0.0,0.0,0.0,0.0,0.0,,0.0,0.0,0.0,0.0,0.0,not much,66D509E0-117C-11F0-AD8F-AF191221A63B,2025-04-04 19:44:04,2025-04-04 19:44:57,,1.0,"{    ""devicemanufacturer"": ""samsung"",    ""deviceplatform"": ""Android"",    ""deviceversion"": ""13"",    ""syncdate"": ""2025-04-04 19:44:58"",    ""utcTime"": ""2025-04-04 17:44:04.734595Z"",    ""projectLanguageSelected"": ""en-US"",    ""timezone"": ""CEST"",    ""appversion"": ""2.2.0"",    ""buildnumber"": ""155"",    ""configversion"": ""1"",    ""devicemodel"": ""SM-G780G"",    ""percentComplete"": ""70""  }",result.zip,0.0
THUAS_S006,experience_log,7.0,,,,,2.0,,2025-04-07 08:36,2.0,4.0,everywhere,"a remark concerning the hourly log sheets. in future research, it might be convenient to make an app for that as well in here. ",0.0,0.0,0.0,0.0,0.0,0.0,,0.0,0.0,0.0,0.0,0.0,not,B15DAE90-137A-11F0-8A64-37454128709F,2025-04-07 08:36:53,2025-04-07 08:37:51,,1.0,"{    ""devicemanufacturer"": ""samsung"",    ""deviceplatform"": ""Android"",    ""deviceversion"": ""13"",    ""syncdate"": ""2025-04-07 08:37:52"",    ""utcTime"": ""2025-04-07 06:36:53.113906Z"",    ""projectLanguageSelected"": ""en-US"",    ""timezone"": ""CEST"",    ""appversion"": ""2.2.0"",    ""buildnumber"": ""155"",    ""configversion"": ""1"",    ""devicemodel"": ""SM-G780G"",    ""percentComplete"": ""70""  }",result.zip,0.0
